@alburov Государственный обвинитель на процессе над Навальным, обвиняемым в мошенничестве, запросил 13 лет тюрьмы и 2 года ограничения свободы + штраф в размере 1,2 млн. рублей.
@Alexand05553087 https://t.co/gj1c5ujSDL не скажу на сколько будет эффективен с вашим ip...но этот еще проверьте. VPN компании под ограничения загодя обновили приложения.
@AZurabAZ Хоть бы его услышали. И нужно снять ограничения в связи с коронавирусом.,не актуальны они уже.
@Bombardir444 @_m_weld ..К слову, вы, наверное, видели, что за эти дни некоторые сетевые магазины (в Москве) просили разрешить им вводить ограничения на количество отпускаемых в одни руки отдельных товаров. Это оно и есть.
@dw_gorod_n Наши старики идут на жесткие ежедневные ограничения, чтобы иметь подушку безопасности. И держат они ее - да, называя гробовыми. Однако могут потратить, если их ребенку нужна помощь или они сами решили, что нужно именно сейчас потратить. И стёб Макса по этому поводу мне непонятен
@dw_russian Ага, значит на NASA  ограничения по экспортному контролю не действуют, ух ты, кому-то можно сотрудничать с рф
@Floppycatman так напиши им в поддержку, обойдут новые ограничения.
@FP2iqG1VrZlsFh В ручной клади есть ограничения, в багаже никто не спрашивает. Так было, во всяком случае.
@Go65Me @Q3TsCd8dWPrdQqe Это не так. Вернее совсем не так. Вы неверно поняли. Все автозаводы продолжают работать. Проблемы возникли из-за логистики с чипами и кабелями. Пока только на двух заводах производящих электромобили в Дрездене и Цвикау введены ограничения. https://t.co/VfPLiyjjHJ
https://t.co/edW5liGPkp В Госдуме предположили, что ограничения с российских спортсменов постепенно будут сняты -  | Новости
@LangdonMarisha Ну у меня нет ограничения, но это пипец, куча всего в куче, плюс много заметок с персонажами, их характерами, привычками, хобби и тд.
RT @AlexZZZ_70: Государственный обвинитель на процессе над каким-то Навальным (кто это?) обвиняемым в мошенничестве запросил 13 лет тюрьмы…
RT @b_bratstvoBron: конгломерат банков Швейцарии выдвинул условия ИЛИ ВЫ СНИМАЕТЕ ОГРАНИЧЕНИЯ НА ФИНАНСОВЫЙ СЕКТОР РОССИИ ИЛИ МЫ УХОДИМ ИЗ…
RT @d5SayyUAL0rLSBL: Зерно и сахар останутся в России: Михаил Мишустин подписал постановление о временном запрете на экспорт зерновых в гос…
RT @erudenko: Российская пропаганда говорит о том, что они блокируют VPN сервисы :-)  Это очень смешно. Сделать они этого технически не смо…
RT @inRussia_online: Тем временем обвинение запросило Алексею Навальному 13 лет лишения свободы, штраф 1 200 000 рублей и 2 года ограничени…
RT @IvanProhorov18: Тем временем вернёмся в Москву.  Обвинение запросило Алексею Навальному 13 лет лишения свободы, штраф 1 200 000 рублей…
RT @kompolk: Ограничения на закупку российского гранулированного древесного топлива усугубляют энергетический кризис.  Говорил же Путин, чт…
RT @lIllllIlllllIIl: Вотсап как верное дитя меты вводит ограничения для россиян с 16 числа. Да когда же уже начнут метить жёлтым стикером?
RT @Nemtsov_most: ⚡️⚡️⚡️По совокупности обвинения прокурор просит назначить Навальному десять лет лишения свободы со штрафом 1,2 миллиона р…
RT @nesanechkaa: База вещает:  Обвинение запросило Алексею Навальному 13 лет лишения свободы, штраф 1 200 000 рублей и 2 года ограничения с…
RT @nesteliza_: Там серьезные ограничения в вопросе свиданий, передач, писем, трат денег с лицевого счета, прогулок. Там принципиально друг…
RT @RuFailedState: ограничения в отношении товаров и товаров и технологий двойного назначения;  ▪️Личные санкции в отношении ключевых «олиг…
RT @RusEmbMNG: ‼️ С 1️⃣4️⃣ марта с.г. при въезде в Монголию не требуется сдача ПЦР-тестов ✔️Карантин и дополнительные экспресс-тесты на COV…
RT @Sandy_mustache: ЕС ввел ограничения на импорт продукции из стали и железа из России и запретил экспорт в Россию предметов роскоши
RT @SotaVision: ‼️ Прокуратура запросила Алексею Навальному 13 лет лишения свободы, штраф 1 200 000 рублей и 2 года ограничения свободы.
RT @svtv_news: ⚡️ Прокуратура запросила для Навального 13 лет лишения свободы, штраф в 1 200 000 рублей и 2 года ограничения свободы.
RT @vikschum: "В четвертый пакет санкций ЕС  вошли новые ограничения на торговлю с Россией. В частности, это запрет на поставки в РФ предме…
RT @villagebel: Какие ограничения по карточкам ввели беларуские банки: Собрали все важные изменения  Читайте на сайте через VPN 👇 https://t…
RT @Z_deadppooll_Z: Государственный обвинитель на процессе над каким-то Навальным (кто это?) обвиняемым в мошенничестве запросил 13 лет тюр…
RT @zgldz: Прокурор Надежда Тихонова запросила Алексею Навальному 13 лет строгого режима, штраф 1,2 млн руб и 2 года ограничения свободы по…
@_tvorozhok @a_ya_uchilka Я к ним в летнюю школу хотела поехать и теперь не знаю, поеду ли. С одной стороны, меня ограничения не касаются, а с другой стороны, непонятно, какая атмосфера-то там будет.
Банки продолжают вводить ограничения, связанные с валютой. Рассказываем, сколько можно снять за раз.   Например, в «Приорбанке» до 3000 долларов в эквиваленте.   https://t.co/IosKU6Erdz https://t.co/gMHBIdoCqE
«Белагромбанк» и «Приорбанк» ввели новые ограничения по снятию валюты и операциям с ней.  Подробности - https://t.co/nMhfSYmQfO https://t.co/E3dHly9uSi
В Биробиджане перекроют движение по улице Миллера  Ограничения будут действовать с 17 марта до 1 апреля https://t.co/S9aUeMDOb6
В Брянской области из-за времени нереста вводятся ограничения на рыбную ловлю- https://t.co/dz5p6PauwW https://t.co/CJlylHmrSB
В Краснодарском крае положительные ПЦР-тесты на ковид получили 843 человека за сутки.  В регионе немного подскочила заболеваемость коронавирусом, но власти продолжают снимать ограничения: https://t.co/2wgEV0dmJ1
В Петербурге рестораны, бары, кинотеатры и другие заведения с 18 марта смогут работать всю ночь. Власти города также разрешили выставки, спортивные и другие мероприятия по ночам.  Ограничения ввели ещё в 2021 году из-за пандемии Covid-19 https://t.co/Pfa93lnWAq
В связи с последними событиями. В сторону @ioannadenisova4 вводятся ограничения.  Данное физ. лицо более не имеет право приближаться к моим булкам, соответственно все любые противоправные действия, которые нарушают данные ограничения, будут караться "лещом"!
В столице и Подмосковье разрешили не беречься от коронавируса: можно снять медицинские маски и не соблюдать соцдистанцию. Какие ограничения власти всё-таки сохранили и ковид ли тому виной?  Подробнее: https://t.co/pC4SXZMH23  #ЖуковскиеВести #ЖВ #Жуковский #Раменское #Коронавирус https://t.co/z5dCvpx4dR
Вотсап как верное дитя меты вводит ограничения для россиян с 16 числа. Да когда же уже начнут метить жёлтым стикером?
Высказываться о «военной операции» сейчас опасно. Но никто не запрещает поразмышлять о том, что теперь делать в условиях внеочередного экономического кризиса и жесткого ограничения свобод. В голову приходит вот что: https://t.co/lYHX0f7MlC
Вьетнам отменил ограничения для туристов и вернул безвизовый режим  https://t.co/EQQ1DWkTdh
Вьетнам отменил ограничения для туристов и вернул безвизовый режим  https://t.co/gteFxDfEkG
Глава МИД Британии Элизабет Трасс в эфире Sky News:   "Будут новые санкции против России - и против большего количества банков, и полная заморозка SWIFT для них, и новые персональные санкции и ограничения для их компаний, и полное уничтожение зависимости мира от их нефти и газа". https://t.co/6zFbBko7jA
Глава МИД Британии Элизабет Трасс в эфире Sky News:   Будут новые санкции против РФ - и против большего количества банков, и полная заморозка SWIFT для них, и новые персональные санкции и ограничения для их компаний, и полное уничтожение зависимости мира от их нефти и газа.
девочки у вайл***ррис огромные проблемы, отключите у карты покупки в интернете  через мобильный банк, лимиты и ограничения
Еврокомиссия объявила о четвертом пакете санкций против России. Новые ограничения включают запрет на сделки с госпредприятиями и импорт из РФ стальных изделий https://t.co/yevuIiZAyg
Если привязать карту #мир к #apple #wallet, то можно платить ей через Apple #pay как и раньше, прикосновением телефона. Такой вот #лайфхак  #санкции #ограничения #телефон
Если сняли в МСК Маски и ковидные ограничения значит ли это, что теперь Путин будет сидеть на совещаниях рядом со своими слугами? Или это другое?
зависит практически весь бизнес, а у нас он есть, а он кормит нас и ещё несколько человек и пару ипотек, а что делать, если введут ограничения по ценам, как на сигареты, только на наш товар  будь я в мск, наверное, куда-нибудь уехала, прихватив друзей и веру в то, что мы сможем
Как перестать орать? Россия ввела санкции против 13 американцев, запретив им въезд в страну. Как заявили в МИДе, эти ограничения стали «неизбежным следствием крайне русофобского курса, взятого администрацией США»
Карантинные ограничения на границе снимает Узбекистан 16 марта  https://t.co/X1xV3sWWg6
Кения отменяет все оставшиеся ограничения для иностранных туристов https://t.co/CdJuTiLRYZ
Китайские авиакомпании активизировали рекрутинг иностранных пилотов: Локдауны и ограничения создают отложенный спрос в будущем https://t.co/GAeW8MW9h7
Ковидные ограничения для кинотеатров -----ВЫ ЗДЕСЬ------ Отмена ковидных ограничений для кинотеатров, новый "Бэтмен" снят с проката в РФ в связи с ситуацией на Украине
Минпред Якутии объяснил ЦУР Якутии ограничения по продаже товаров в одни руки:  «Норма &lt;…&gt; вызвана необходимостью обеспечения наличия товаров на полках магазинов, а также недопущению необоснованного, спекулятивного приобретения товаров в целях перепродажи по увеличенным ценам». https://t.co/DbfBGnQQQ2
Мордовия снимает ограничения по ковиду https://t.co/FEoqTFK8nw https://t.co/2rFFQogCHM
На границе Брянской области и Белоруссии снимут коронавирусные ограничения https://t.co/IvEdoJVTlT  Решение ограничить сухопутное сообщение через границу с Белоруссией вводилось постановлением российского правительства на фоне пандемии коронавируса #Брянск #НБ https://t.co/BzYylfo8s8
На заседании Лефортовского суда Москвы прокурор запросил для Алексея Навального 13 лет лишения свободы, штраф в 1,2 миллиона рублей и 2 года ограничения свободы.   В этот раз оппозиционеру вменяется мошенничество и оскорбление судьи. Политик свою вину ...  https://t.co/owHjHHnfVY
Но в конце концов Трюдо был вынужден отменить режим ЧП, так как протесты не прекращались, а премьеры провинций начали отменять карантинобесные ограничения, против которых и протестовали люди.
О позитивных (условия для зачета) и негативных (ограничения зачета) предпосылках зачета читайте в новом номере #журналЗакон  https://t.co/fktmYM9zpq https://t.co/Jx366IHbvZ
⚡️⚡️Обвинение запросило Алексею Навальному 13 лет лишения свободы, штраф 1 200 000 рублей и 2 года ограничения свободы.  Его обвиняют в мошенничестве и оскорбление судьи.
Обвинение запросило Алексею Навальному 13 лет лишения свободы, штраф 1 200 000 рублей и 2 года ограничения свободы. https://t.co/vJT3F3RryS
⚡️Обвинение запросило оппозиционеру Алексею Навальному 13 лет лишения свободы, штраф 1 200 000 рублей и 2 года ограничения свободы.  Его обвиняют в мошенничестве и оскорбление судьи.  Путин боится.
Пока мы тут Украину обсуждаем... ⚡️⚡️Обвинение запросило Алексею Навальному 13 лет лишения свободы, штраф 1 200 000 рублей и 2 года ограничения свободы.  Его обвиняют в мошенничестве и оскорбление судьи. https://t.co/I19WNrFASG
Помимо этого, прокуратура требует назначить оппозиционному политику штраф в размере 1 200 000 рублей и 2 года ограничения свободы  https://t.co/3ROCNjUUX8
Прокурор Надежда Тихонова запросила Алексею Навальному 13 лет строгого режима, штраф 1,2 млн руб и 2 года ограничения свободы по новому делу о нецелевой растрате денег Фонда Борьбы с Коррупцией (*признан иноагентом) и оскорблении суда. За доказанное убийство в РФ меньше дают. https://t.co/8s1BtuRnXq
Разбираем постановление губернатора о комплексе антиковидных мер: какие ограничения сняты, а какие еще нет  https://t.co/d8hMf9IX8V https://t.co/hUxcKBCr7n
Российская пропаганда говорит о том, что они блокируют VPN сервисы :-)  Это очень смешно. Сделать они этого технически не смогут, если VPN сервис нормальный.  Я работал с командой ExpressVPN, они удачно обходили все запреты Китайског фаервола, обходя все новые ограничения.
С 18 марта Великобритания отменит почти все ковидные ограничения для туристов - https://t.co/H2aEfX6KGA
Социальные учреждения края вернулись к штатному режиму работы, а общепиту на час продлили режим работы  Власти в Хабаровском крае смягчили ковидные ограничения, разрешив, в частности, социальным учреждениям вернуться к штатному режиму работы и продлив ...  https://t.co/G6DaUIqt4X https://t.co/JQmzOW7FdZ
Также торжества, мероприятия, кафе, рестораны без каких-либо ограничений #tukmd #Тараклия #новоститут #вернисебепрежнююжизнь #ограничения #ковид #TeamEurope #COVID19 #StrongerTogether #EUMoldovaStrongerTogether https://t.co/zPEg11pJZC
Там серьезные ограничения в вопросе свиданий, передач, писем, трат денег с лицевого счета, прогулок. Там принципиально другой контингент (там не сидят первоходы, например, зато сидят за особо тяжкие преступления). За малейшую провинность — карцер.
“Твой эксперт”: в Центробанке ответили на главные вопросы о SWIFT, Visa, Mastercard и о новом виде мошенничества Какие ограничения коснулись зарубежных денежных единиц, стоит ли бояться отключения от недавно ставшей изв... https://t.co/LTdnwQsaS0 https://t.co/9BIuUPFt7n
Тем временем вернёмся в Москву.  Обвинение запросило Алексею Навальному 13 лет лишения свободы, штраф 1 200 000 рублей и 2 года ограничения свободы. Его обвиняют в мошенничестве и оскорбление судьи.
Узбекистан снимает карантинные ограничения на границе https://t.co/bS0lvm0Oxi
