@32_dec И эти же люди в первых рядах кричат какие беженцы у нас (в росии) неблагодарные. Типо всё им надо предоставить и в лучших условиях. А то что сами такие и даже хуже, ну норм че😋
@alyonapopova данные недостоверны. Беженцы и так были. Жить лучше чем Россия? это тогда когда у тебя заканчиваются деньги для выплаты пенсий гражданм, и ты отказываешь в любом финансировании ЛДНР? это лучше? или когдла народ в столице - в Киеве, не может коммуналку оплатиь, это лучше?
@antifa2022 @serial_jane Однозначно. Какой-то дремучий колхоз там, разброд и шатание. Это при том, что беженцы потоком идут. Надо же как-то реформировать систему :(
Bild: В Германии беженцы изнасиловали 18-летнюю украинку https://t.co/lVDfV0kenX https://t.co/ucSHA6LvmN
@GazetaRu А если беженцы скажут, что они- репатрианты? https://t.co/HS2X2B9vEq
@GazetaRu В Европе почти 3 миллиона. Что-то беженцы не сильно хотят к освободителям выезжать.
@Heie24766520 @Rogozin Сейчас к вам беженцы приедут из Украины и потом ты напиши свои впечатления от этого народа Я думаю ты сильно поменяешь свое мнение
@Hizhnyak_Marina они защитники чего? расизма? В Украине до прихода России не было ни одного беженца. А потом беженцы начали бежать не в Россию а на Запад. Так чтотвы делаете на Украине? Мразоты....
https://t.co/0EOadO403Z сайт на 12 языках, где украинские беженцы, спасающиеся от «военной спецоперации», могут сразу найти хозяев квартир , готовых помочь, их номера и квартиры. Передайте эту информацию другим украинцам, которые сейчас находятся в странах Европы и не только.
@leraleecova @VanessaBeeley @MuradGazdiev Да у нас в городе живут беженцы. И я вам объяснил, что под еденичными случаями я имею в виду видео, с не особо адекватными людьми, которые использует ваша пропоганда. А не жертв конфликта на Донбасе
@meduzaproject На деле европа такая мы за Украину) а когда приезжают беженцы, так разговор уже другой...
@mihalychzloy @YmetTeb Ничего удивительного. Беженцы в основном из русскоязычных регионов Украины
@Nino_Giorgidze @Sandy_mustache Они бы пошли, если бы их пустили. Коридоры были открыты только в западном направлении. Вчера Мариуполь вскрыли, так все беженцы рванули в Россию.
@novaya_gazeta хихи. Не порите ерунды. Украинские беженцы никогда не вернутся на Украину их вполне устроит статус беженца в ЕС. От такой халявы еще ни один украинец не отказывался
@ProstoDoktor20 @AlexSAR234 Кто страдает,пусть едет в неметчину,там их местные беженцы будут пизди.ть! Счастливого пути!
RT @AlexeyNemo: ДНР.  «Выскочили из города чудом»  Беженцы рассказали о том, как покидали Мариуполь.  https://t.co/wUkl6GCx91 https://t.co/…
RT @Andriy_Zas: @ibubenagain @stabilnosti Никто не будет уничтожать Москву с неба.  Она будет уничтожена через невозможность поддержания ее…
RT @antony_mon: Беженцы эвакуируются, после недель в подвалах под обстрелами без связи. Тут бабушка, которая выбралась из Калиновки, говори…
RT @bookforcooking: В Дрездене в полиции написала красными жирными буквами на листе: "Русский военный корабль иди нахуй!" Там были африканц…
RT @dmitry_gordon: Мокрик: Русскоязычные беженцы во Львовской или Тернопольской области – не гости, они в своем государстве. Не нужно "язык…
RT @injecteer: Должны ли профессиональные украинские беженцы посетить в Мюнхене известное кладбище?
RT @lucifer_safin: Кто-то недавно писал что это начнется через 5 лет. Вы плохо их знаете. Пять, сука, дней.  "Мы тоже беженцы, нам тоже пло…
RT @myrevolutionrus: Обложки ВСЕХ главных британских газет.   На них беженцы, Абрамович на пуфике, захват «дома Дерипаски», Екатерина Андре…
RT @n_ma_pag: Первые беженцы из Мариуполя уже в Запорожье. Путин сломал жизни миллионам людей. https://t.co/feiBLSMz8n
RT @Sandy_mustache: РИА Новости: В Германии заявили о прибытии 147 тысяч беженцев с Украины  И ни у кого в РФ не возникает вопросов, почему…
RT @Stenografija: #Украина #ЕС  Чем больше чубатых сбегут в Европу, тем быстрее они обрушат её! Это не беженцы с арабских стран, те еще не…
RT @TT_TTINFO: ИЗРАИЛЬ ОТКАЗАЛСЯ ПРИНИМАТЬ БЕЖЕНЦЕВ ИЗ УКРАИНЫ И ПРИОСТАНОВИЛ «БЕЗВИЗ» Читать: https://t.co/ugkuP0yZkR #Израиль #Украина #б…
RT @Vasilisa_Larina: ❗«Выскочили из города чудом»  Беженцы из Мариуполя рассказали, что украинская техника на самом деле стоит в жилых квар…
RT @WHpHnXu6Ewr2Qqm: Обложки ВСЕХ главных британских газет на 14.03.2022.   Тут беженцы, Абрамович на пуфике, захват «дома Дерипаски», Екат…
@RT_russian's account has been withheld in Portugal, Finland, Sweden, Ireland, Slovenia, Czech Republic, Poland, Slovakia, Hungary, Italy, Malta, Germany, Greece, Romania, Netherlands, Bulgaria, Austria, Luxembourg, Latvia, Denmark, Lithuania, Croatia, Estonia, Cyprus, France, Spain, Belgium in response to a legal demand. Learn more.
@Sandy_mustache Беженцы появились в России в 2014 году
@Sandy_mustache Давно не волнуют беженцы в германии
@Sandy_mustache Ты забыл сказать что беженцы Донбасса рванули в Россию еще в 2015 году. Или Донбасс в то время Украиной не считался ?
@SergNevatnikov @artem_manevich Цены выросли. Сейчас пол Белоруси и России сюда едет + беженцы с Украины. Так что это не так удивительно.  Хотя Батуми выглядит как все ещё пустой, по сравнению с летним сезоном. Никакого булинга или русофобии нет, единичные случаи какие то бывают.
@sevindj17 @PA00440182 @__Shekili__ @ogeday_nigar Беженцы* 😁
@sevindj17 @PA00440182 @__Shekili__ @ogeday_nigar Сева, я понимаю твою точку зрения и местами разделяю ее. Действительно, очень много войн было с согласия (молчаливого или нет) Европы. И сейчас этим беженцы - это их карма.За всё в этой жизни нужно платить.  Но, с другой стороны, обычные немцы же не виноваты в этом, а убивают их.
@sharijnet Какие это "беженцы" ясно, но нацики адресом ошиблись Аргентина не там в Израиле  Моссад
@Sibilochka888 @BirdsPrima @AdmiralMiki @kolyuchii Беженцы откуда?
@Sibilochka888 @cypruscano @BirdsPrima @AdmiralMiki @kolyuchii Какие могут быть беженцы в Грузию в 2008, если вас из южной Осетии ещё в 90-е выгнали?
@thorn_crumble Беженцы пишут 🥲 в Директ &amp; блоггеры
@Val_Scherbak как вы задрали со своим небутербродом, он такая рашист, как и 99,9% населения. хочу увидеть мир, где на територии лаптестана  дети сидят в подвалах без воды, как в Мариуполе, разруха, кровь, сльозы, беженцы, но их никто не принимает
@Vilaaa09 @VanessaBeeley @MuradGazdiev Вы мне о чем говорите? У вас в городе живут беженцы? Какие единичные случаи? Я буду очень рада если господин Зеленский попадет в руки не к нашим военным (нам придется с ним церемониться), а в руки отряда ДНР. И никто не заплачет когда они разорвут его живьем за своих детей.
@Warlukyn @Rogozin Но меня радует что вы вырождаетесь. Насильственная ЛГБТ, разрушение института семьи, падение религии, беженцы. Я рад что через поколение вы исчезните.
@zenonBk @HawkTrades @sfteslaclub @elonmusk @Rogozin Дело в том, что в Польшу едут в основном жители из западной части Украины, а в Россию - беженцы с восточной и южной. К сожалению, жители западной части могут даже не знать, что их правительство творит на востоке и юге Украины. Поговорите с жителями Донбасса.
@zislik @Sandy_mustache Беженцы из Сирии побежали в 2011 году, только они сначала бежали в Турцию, а потом их Эрдоган пустил в европу, шантажируя и выторговывая для себя плюшки.
А беженцы- то из разных стран беженцам рознь! То, что  одним запрещено, ... https://t.co/2E49ztby2f через @YouTube
Беженцы в Испанию с Украины/Снимаем розовые очки#испания#украина#беженцы# https://t.co/LITYUUywDc через @YouTube
Беженцы все разные: растерянные, деловые, плачущие, злые, ненормальные, антипрививочники, усталые, усталые, усталые. Весёлых не видел.
Беженцы из Карабаха сегодня проводят акцию протеста у правительства Армении.  Протестующие требуют, чтобы правительство Армении отреагировало на их вопросы, ситуацию на границах, в частности, у участка села Неркин Ханд в Сюникской области (Неркин Анд Зап… https://t.co/zGZn2MO9MJ
❗Беженцы из Рубежного рассказывают как при попытке эвакуироваться попали под обстрел украинскими военными и как русские солдаты помогли им выбраться  "Сумбурные воспоминания о том, что нужно было вытащить отца. Загорелась машина взорвалась. Попали в мотор. Мы вылезли из нее https://t.co/qcLln00qDe
Беженцы с Донбасса, а это прежде всего - женщины и дети - получают в пунктах временного размещения необходимую помощь. Их поддерживают волонтёры Единой России, дежурят и медики. Подробности в нашем видео.  #своихнебросаем #мывместе #времяпомогать #Zамир https://t.co/doJOF8mWAp
Беженцы с Донбасса, а это, прежде всего, женщины и дети, получают в пунктах временного размещения  необходимую помощь. Их поддерживают волонтёры «Единой России», дежурят и медики.   Подробности – в нашем видео.    #своихнебросаем #мывместе #времяпомогать #Zамир https://t.co/NV3x6YAuXj
Беженцы эвакуируются, после недель в подвалах под обстрелами без связи. Тут бабушка, которая выбралась из Калиновки, говорит родным, что жива. Таня ей дала для этого свой телефон.   Фото @YurchenkoSt. Горжусь ими очень https://t.co/S8rY4e2eQz
Блядь, как у них всё сложно! Хохлушку ебут иракец и нигериец, но при этом все украинские беженцы! Ну что я могу сказать по данному поводу?  Ебитесь дальше! https://t.co/rDL6Svhxhz https://t.co/pIOoJOSP2R
Будут ли размещены беженцы в виллах олигархов в Юрмале? https://t.co/ti9tF8Bvgm  Муниципалитеты вокруг Риги не спешат создавать центры приема беженцев для людей, спасающихся от войны в Украине. https://t.co/uENaNLNYDU
В Красноярском крае и Хакасии этот год начался с вымирания населения  https://t.co/cS8Bzwmp13 - Ничего, сейчас подтянутся беженцы. Выстоим.
В Тюменскую область приехали первые беженцы   https://t.co/os3BH77RIv https://t.co/KLjIS7WNT3
Вот вам сегодняшние обложки ВСЕХ главных британских газет.  Тут беженцы, Абрамович на пуфике, захват «дома Дерипаски», Екатерина Андреева, три погибших английских наемника, китайская поддержка России. И ни слова о погибших в Донецке.  Их для западного мира просто нет. https://t.co/91MODoZPln
❗«Выскочили из города чудом»  Беженцы из Мариуполя рассказали, что украинская техника на самом деле стоит в жилых кварталах.   "Семью брал, и ехали на удачу - расстреляют, значит расстреляют. Нет - значит нет. Там холодно, голодно. Воды нет, еды нет. https://t.co/TDcVoQkQoO
#Дагестан отправил около 80 тонн гуманитарной помощи беженцам с Донбасса. Фуры с гуманитарной помощью отправились из Дагестана к жителям Донецкой и Луганской народных республик, которые сейчас размещены в Крыму.  #Донбасс #беженцы  Подробнее: https://t.co/m0YBcYDBVU https://t.co/dEmxwnAsUe
ДНР.  «Выскочили из города чудом»  Беженцы рассказали о том, как покидали Мариуполь.  https://t.co/wUkl6GCx91 https://t.co/LODX1eek9X
Должны ли профессиональные украинские беженцы посетить в Мюнхене известное кладбище?
За сутки в Беларусь проследовал 341 гражданин Украины - Радио Мир в Беларуси https://t.co/jE28zOu6Of  #twiby #Беларусь #Украина #ЕС #кризис #эвакуация #граница #беженцы
ИЗРАИЛЬ ОТКАЗАЛСЯ ПРИНИМАТЬ БЕЖЕНЦЕВ ИЗ УКРАИНЫ И ПРИОСТАНОВИЛ «БЕЗВИЗ» Читать: https://t.co/ugkuP0yZkR #Израиль #Украина #беженцы https://t.co/pPMvg9YNMp
кстати об этом !! я не коренная украинка вообще нет у меня бабушка и дедушка беженцы оттуда а я родилась уже в Казахстане но по паспорту там я да https://t.co/YZBpHAiVAO
куда бегут украинские беженцы? они бегут как можно дальше от «русского мира» https://t.co/WUCB7OkshZ
Началось в колхозе утро...😡  18-летнюю беженку из Украины, которая приехала в Дюссельдорф, изнасиловали на пару уроженцы Ирака и Нигерии. На борту плавучего отеля, пришвартованного на берегу Рейна. Насильники имеют также и украинское гражданство. Тоже беженцы.
Обложки ВСЕХ главных британских газет на 14.03.2022.   Тут беженцы, Абрамович на пуфике, захват «дома Дерипаски», Екатерина Андреева, три погибших английских наемника, китайская поддержка России.  И ни слова о погибших людях в Донецке.   Их для западного мира просто нет. https://t.co/CWbY417vGl
Первые беженцы из Мариуполя прибыли в Запорожье #Донецк https://t.co/5nWUIdyPEL
По вечерам хожу волонтерить в глав. вокзал Hauptbahnhof, куда приезжают беженцы и где не хватает русс/укр язычных волонтеров. Вы бы видели сколько боли в глазах новоприбывающих…с одним тяжеленным пакетом, с пустотой во взгляде, с плачущими детьми, с надеждой на лучшее будущее
По телеку говорили о том, что украинские беженцы в Молдове хуёво относятся к тем, как их приютили и требуют удобств   Чуваки  Я в эту хуйню в жизни не поверю  Любой человек который умеет логически мыслить поймёт, что это наглый пиздёж Люди сбежавшие от ВОЙНЫ не будут так делать
Поступают сведения о том, что некоторые украинские беженцы, разместившиеся в Испании, стали без спроса занимать недвижимость россиян в этой стране.
Странно в людей стреляют, а они боятся умереть от холода и голода. Если брешете, то хоть лгите правдоподобно!!!  "От холода и голода умирать не хочется": беженцы выезжают из Мариуполя в Россию:  https://t.co/yPWCK2lsjn
Украинские беженцы в Европе https://t.co/Q6XMaJQUxi
Украинские беженцы дорого обойдутся Дании https://t.co/AZ1LlBW7Js
❗Украинские власти удрали из Волновахи и даже не сообщили людям, что нужно эвакуироваться.  Об этом рассказали беженцы Наталья Дубинина и Виктор Белик, просидевшие вместе с другими соседями две недели в подвале дома. https://t.co/SVENqHfY4E
ЧЕХИЯ УЖЕ НЕ СПРАВЛЯЕТСЯ С ПОТОКОМ УКРАИНСКИХ БЕЖЕНЦЕВ Читать: https://t.co/FvpUOU6Odc #Чехия #Украина #беженцы https://t.co/blsSAtAdL9
