⛽ Довгий час Росія шантажувала ЄС постачанням енергоносіїв. Однак, відмова від російських нафти та газу буде менш витратною для Європи, ніж прийнято вважати  Переговорна позиція ЄС сильніша – і потрібно цим скористатися задля досягнення миру  https://t.co/LwfwlPPUrC #StopRussia https://t.co/6Nfz5oi6F8
@MirAckerman @laugh_in_pain @oleh_kurza Якщо їх підорне США з обов'язковим залученням Канади, ЄС, Тайваню, Японії і т.д., то це буде сильніше, ніж будь-що від росії. Якщо ви не в курсі, то їх позиція вже змінилася у порівнянні з 24 лютого (Ван І назвав "спецоперацію" війною, наприклад), ще й гуманітарку відправлять.
@pFd8kgIe4Ybc8sg @Podolyak_M Це дуже розумна позиція, але я думаю, що компромісів не треба. я вважаю, що треба вимагати закінчити війну, вони нам тільки будуть казати не вступати в ЄС та НАТО.  Але я думаю, що у Вас більш правильна позиція, тому що якась маленька дівчина не зможе прийняти правильних рішень.
RT @boomych: Я правильно розумію, що люди, яким не подобається позиція Ізраїлю та деяких країн ЄС, і люди, яких повністю влаштовує поведінк…
RT @Helg40498291: В соцмережах почалася улюблена гра українців Зрада-Перемога.  Ми формально не члени НАТО, але зараз щільно інтегровані в…
RT @Vox_UA: ⛽ Довгий час Росія шантажувала ЄС постачанням енергоносіїв. Однак, відмова від російських нафти та газу буде менш витратною для…
В соцмережах почалася улюблена гра українців Зрада-Перемога.  Ми формально не члени НАТО, але зараз щільно інтегровані в його структури. Тому не буде ніякого одноосібного рішення Зеленського чи колективного Ради по умовах миру. А буде спільна позиція України, США, Британії, ЄС.
Сьогодні Макрон сказав, що не бачить Україну в ЄС, Німеччина постійно блокує нам якусь допомогу, США говорять, що не так на ті польські винищувачі і треба. Хз, що вони там роблять "в тиху", але по факту — це позиція обісцяних нікчем.
Я правильно розумію, що люди, яким не подобається позиція Ізраїлю та деяких країн ЄС, і люди, яких повністю влаштовує поведінка Єрмака, Арестовіча, Подоляка, ДБР та іншої піздоти (влаштовує, бо ніяких дій не бачу) - це все тіж самі люди?  Браво! Ви охуєнні патріоти.
