יהוה Greenski signed the criminal responsibility law for collaborating with Russia. The highest measure of punishment, according to the law, is 15 years of freedom. The television news service (https://t.co/f27zCXMOrv)
▪ Corporate Slack scheduler confirmed job restrictions in RF
@bryhynets God, as many as can be:-) BpLAs do not fall under the limits of the closed sky.
@DarkaHirna, who suffered from the Nazis all over the world, has now entered the restrictions for entry into  Oh, you need a visa or an invitation with a Jew's seal, and the wife hasn't been able to get to her relatives, because at 00:00 they haven't let the plane in.
@GreyWraith Only a law that sets limits for people convicted by this article. The article itself is still valid
@Horeca18 is of course necessary, but not now (when the boxes are received) because everyone is running, everyone needs to be loaded with a task, a narrow space of somatoha, sometimes chaos, nerves. Some tasks have limitations in the scale of the empty kitchen. All participants are running full-time service checks to be warned about.
@MaxDamage2Russ @donikroman we found a way to get to a/b from Poland, but export restrictions from the United States are news to me. Can you write the DM, if you've decided?
@MIKhun and fuck with him with life rights, it's not absolute. may start with a ban on moving rights and end up legalizing things like torture:)
@mmacarella @yxo7 Visual Mode of Reparation and Rehabilitation of Armies abroad in 2014, with Ukraine's return of the entire territory, Bringing the Military Criminals Restriction to the Armed Forces Justify the Russian Peace to Gather All Nations to Terrorism
@nichvydicia is a precedent when the regime changed and the old man was given new power, and the main cause of our international lawyers at the moment is a separate tribunal in the crimes of Russia and leadership, like Nuremberg, and there will be no legal restrictions.
@Novynarnia Only a law that sets limits for people convicted by this article. The article itself is still not valid. • The site still has a project hanging on it. The bone for the people, type signed, was dropped, and the problem is for the poor. https://t.co/MNT0M0Wq
@pasha4ua @donikroman, if I understand correctly, limits can be depending on % produced in the United States by the parts and the distance of the flight/fly mass, but I'm not special. The producers often know whether their specific drone is controlled or not. It's better to ask the manufacturer directly.
RT @5chANEL: Eurosoy approved 4 packets of sanctions versus moscows that are still bound to be hit by the aggressioner https://t.co/O2tyG90mKh #new
RT@Adrian_cherniv: @GreyWraith only law that sets limits for people convicted by this article. The article itself is still valid
RT @dfyz2007: @Novinarnia Only a law that sets limits for people convicted by this article. The article itself is still valid.
RT@dw_ukrainian: Until Russia's fourth batch of sanctions for her war against Ukraine new restrictions on trade with Russia. This is especially...
RT @EUDegationUA:  Oh, our determined support for Ukraine and its people lasts. The 4th batch of sanctium is seriously affected by the economy, the mat...
RT @logvinko: Friends, jub just blocks or imposes restrictions on the @ukrainer skal video in dark comments all the time, so there is no illusion who...
RT @NataLeRmk:  Oh, they sell the Mordora goods in two ways, regardless of the EU's limitations.
RT @RomanMoscal70: Belarusian banks have added significant restrictions on the removal of protein cash. Priorbank - Previous order to more than...
RT @ua_polltava: Over a day on the Pollocks, more than 700 suspicious people were found. Most of them violated the curfew's restrictions....
RT @Vodafone_UA: For all the time of the war and in Victory including we have removed mobile Internet restrictions from the smart phone to other devices...
@simp4wave is also literature so I think a good idea but maybe you've got some limitations
@st_imidazolium Not sure because the restrictions have been lifted knowing of the new wave, but nevertheless they do take off -- but people are still very active in wearing masks that are pure to themselves, because here is really paranoid about the crown and for two years of conscientious wearers who are standing out of masks.
@Wollek_Sir, you have the limitations of https://t.co/GqcG4yekA5
The bank has limited the maximum amount that can be obtained in a currency to more than $100 a month. These limits work both in Belarus and abroad.
Belarusian banks have imposed significant restrictions on the removal of cash by Belarus. Priorbank - Previous order for more than 1,000 white rubs or more than $10. The maximum payment is no more than 3,000 per person. Blagroprombank - the maximum payment per month is $100 source: @Belsat_TV
In the chat room, Cadirov's 15 minutes limit is no longer interesting, but here's the cadrews, because it's not Chechens, it's some stupid creature that's embarrassing the whole of Chechnya.
In the fourth batch of sanctifications for Russia for its war against Ukraine new restrictions on trade with Russia were introduced. In particular, this is a ban on the delivery of luxury items to the RF. Also to stop imports into the European Union of Russian steel and iron https:/t.co/y1wioTua7
The European has approved 4 packets of sanctions against the Moscow יהוה which will still limit the impact of https://t.co/O2tyG90mK #new
Over a day on Pollock, more than 700 suspected people were found. Most of them violated curfew restrictions. https://t.co/gC8AVWyIUF
What are the options for getting to the left side of the right?
When the war ends, there's only two answers, there's only one choice from our society.
The Slack Corporate Messenger confirmed the FF ban on https://t.co/pr1AZfUkz https://t.co/uP3cfSJwaQ
I need limits. I'm never going to define--
Metaspace is virtual space that allows you to overcome the constraints of the real world.
At the time of the war and the Victory, we've canceled the internet restrictions from the smartphone to other TP devices on the bottomless Internet. Provides a month-terressing and ?net-to-day distribution is free from now on and off automatically. https://t.co/50KFp11YSZ
At Zacarpathi the ban on the sale of alcohol at https://t.co/9z46qPYEG the Defense Council of the Transcarpathian Region decided to allow between 8:00 and 8:00 a.m. to sell soft drinks, beer and wine at the time of war.
▪ Our strong support for Ukraine and its people lasts. The fourth batch of sanctifications is seriously affected by the economy, the base of the financial and technical provisions for the invasion of Ukraine. This package is aimed at limiting the possibility of financing the Kreml's war machine, יהוה @JosepBorrellF https://t.co/V1o2KQ85X
The new EU sanctifications on Rf Ban on transactions with some state enterprises, ban on new investment in energy. The section limiting trade in iron, state-of-the-art luxury features against keys.oligars, lobbyists for airlines. Shipbuilded.
The EU has come under new eminences, with the •Rosnefhtegnephs and יהוה. These can only be used to deliver fossil fuels in the EU. The restrictions are also applied to a number of companies that work for defense at https://t.co/EudqrGQGQR
A popular vigilantor began to exclude users from Russia at https://t/c/Z9IoBUkeRY, claiming that several Russian organizations have reported full limits on their accounts. https://t.co/kO4qZWEFD
Sunactions vs. Russia: what limitations against RF have been introduced by Great Britain, Canada, Spain, Switzerland - TSN https://t.co/9Yp4834FED #UkraineNews #UkrainianNews https://t.co/ERqXDgXDF
causing local pain and discomfort and apparent movement limits. &gt;&gt; Second, feeling the cold of the wind, for example, the cold of sleep,
The Zacarpathian region has weakened alcohol restrictions in more detail - https://t.co/qKDZ5rCGe https://t.co/FEVDV8sF
THE concern may be that someone knows when I'm going to Google: How specifically does the restriction of male leaving the country (this is the text of an article) and what is the status of men who were abroad at the time of the law, or who crossed the border illegally?
If you have the habit of reproving yourself for delaying a couple of lines from Jahlah to reflect on the fact that each choice brings a rejection, each refusal shows us our limitations and temporaryity.
